A3: Week | B3: Day | C3: Date | D3: Topics
A4: 1 | B4: M | C4: 38075 | D4: Elementary Statistical Mechanics
B5: W | C5: =C4+2 -> 38077 | D5: Introduction to Scientific Programming in GNU/Linux
A6: 2 | B6: M | C6: =C4+7 -> 38082 | D6: Monte Carlo (MC) Simulation: Background & Theory
B7: W | C7: =C6+2 -> 38084 | D7: MC Simulation: Practical Matters
A8: 3 | B8: M | C8: =C6+7 -> 38089 | D8: MC Ising
B9: W | C9: =C8+2 -> 38091 | D9: MC Harddisk
A10: 4 | B10: M | C10: =C8+7 -> 38096 | D10: MC LJ Fluid
B11: W | C11: =C10+2 -> 38098 | D11: Molecular Dynamics (MD) Simulation: B&T
A12: 5 | B12: M | C12: =C10+7 -> 38103 | D12: MD Simulation: LJ Statics
B13: W | C13: =C12+2 -> 38105 | D13: MD Simulation: LJ Dynamics
A14: 6 | B14: M | C14: =C12+7 -> 38110 | D14: Ensembles: Monte Carlo
B15: W | C15: =C14+2 -> 38112 | D15: Ensembles: Molecular Dynamics
A16: 7 | B16: M | C16: =C14+7 -> 38117 | D16: Free Energy Calculations
B17: W | C17: =C16+2 -> 38119 | D17: Gibbs Ensemble Monte Carlo
A18: 8 | B18: M | C18: =C16+7 -> 38124 | D18: Advanced Topics: Path Sampling Monte Carlo
B19: W | C19: =C18+2 -> 38126 | D19: Advanced Topics: Wang-Landau Monte Carlo
A20: 9 | B20: M | C20: =C18+7 -> 38131 | D20: Advanced Topics: Long-Range Forces
B21: W | C21: =C20+2 -> 38133 | D21: Buffer day
A22: 10 | B22: M | C22: =C20+7 -> 38138 | D22: Memorial Day Holiday
B23: W | C23: =C22+2 -> 38140 | D23: Presentations (10-11:20)
A24: 11 | B24: M | C24: 38145 | D24: Presentations (10:30-12:30)